title;isbn;authors;description
i help you cook The successful universal cookbook with a large baking section;5554-5545-4518;null-walter@echocat.org;If you are looking for a basic cookbook, you are faced with a wealth of alternatives these days. It's difficult to find the right mix of basic work and recipe collection for you. You should be clear about what you want to focus on or what cooking and baking skills you can already assume.
The big GU cookbook cooking for children;2145-8548-3325;null-ferdinand@echocat.org,null-lieblich@echocat.org;It starts with... the first spoonfuls for mommy, daddy and the rest of the world. Yes and then? What manufacturers of baby food can do, you can often do it yourself in no time at all, maybe even healthier, often fresher. The cookbook appeals to older babies and school children, and it does so in a playful, age-appropriate way.
Slim in your sleep ;4545-8558-3232;null-gustafsson@echocat.org;Slim in your sleep sounds like a beautiful dream, but it really is possible. But not after a salami pizza for dinner. The basics of this new concept are a type-appropriate insulin food combining diet as well as food and exercise in rhythm with the biological clock. How the biological clock ticks and what should be on the menu depends on your personal archetype: nomad or farmer?
The perfect dinner. The best recipes;2221-5548-8585;null-lieblich@echocat.org;You also want to create a perfect dinner? With this book you can do it!
The Pirate Cookbook. A specialty cookbook with the 150 most delicious recipes ;3214-5698-7412;null-rabe@echocat.org;The pirate cookbook proves that the pirate captains were feared warhorses, but on the other hand sometimes had a superior sense of taste. ... In short, an ideal book to provide a culinary setting for maritime events.
Awesome Italian;1024-5245-8584;null-lieblich@echocat.org,null-walter@echocat.org,null-rabe@echocat.org;Celebrity chef Jamie Oliver has been touring Italy in his VW bus -- and he's got all sorts of things bring some culinary souvenirs. It's worth checking your luggage...
O'Reilly's Cookbook for Geeks;2215-0012-5487;null-mueller@echocat.org;According to popular belief, geeks thrive on cola and frozen pizza, which they wolf down absentmindedly at night on the computer. So far the cliché! But that cooking has a lot to do with programming, that it is similarly creative, that many paths lead to individual goals and that some recipes are just crazy and - yes, geeky: that's what two cooks in this book show.
Schuhbeck's cooking school. Learn to cook with Alfons Schuhbeck;1215-4545-5895;null-walter@echocat.org;Every beginning is easy! At least when you have a teacher like Alfons Schuhbeck by your side when you learn to cook. With its help, even the most clumsy beginner can get top marks for his dishes. The trick that the award-winning master chef uses is visualization. The individual work steps are shown on color photos in the format of approx. 3x4 cm. Below these are brief and concise information on the preparation. In this way, Schuhbeck's cooking school conveniently presents everything at a glance. And the interested novice cook can concentrate on the main thing - cooking. The color photo on the left shows what the food should look like, on which the ingredients - thanks to the clever layout - are also listed very clearly. Schuhbeck also gives concise recommendations on ingredients and preparation.
